{
  "$schema": "https://json-schema.org/draft/2020-12/schema",
  "$ref": "#/definitions/MCLOUD",
  "definitions": {
    "MCLOUD": {
      "type": "object",
      "additionalProperties": false,
      "properties": {
        "_uuid": {
          "type": "string"
        },
        "_type": {
          "type": "string"
        },
        "title": {
          "type": ["string", "null"],
          "minLength": 1
        },
        "events": {
          "type": ["null", "array"],
          "items": {
            "$ref": "#/definitions/Event"
          }
        },
        "origin": {
          "type": ["string", "null"]
        },
        "license": {
          "$ref": "#/definitions/KeyValue"
        },
        "spatial": {
          "type": ["array", "null"],
          "items": {
            "$ref": "#/definitions/Spatial"
          }
        },
        "keywords": {
          "type": "array",
          "items": {
            "type": ["string", "null"]
          }
        },
        "mfundFKZ": {
          "type": ["string", "null"]
        },
        "temporal": {
          "$ref": "#/definitions/Temporal"
        },
        "addresses": {
          "type": "array",
          "items": {
            "$ref": "#/definitions/Address"
          },
          "minItems": 1
        },
        "DCATThemes": {
          "type": "array",
          "items": {
            "type": "string"
          },
          "minItems": 1
        },
        "description": {
          "type": "string",
          "minLength": 1
        },
        "periodicity": {
          "oneOf": [
            {
              "type": "null"
            },
            {
              "$ref": "#/definitions/KeyValue"
            }
          ]
        },
        "accessRights": {
          "type": ["string", "null"]
        },
        "mfundProject": {
          "type": ["string", "null"]
        },
        "distributions": {
          "type": "array",
          "items": {
            "$ref": "#/definitions/Distribution"
          },
          "minItems": 1
        },
        "mCloudCategories": {
          "type": "array",
          "items": {
            "type": "string"
          },
          "minItems": 1
        }
      },
      "required": [
        "_uuid",
        "_type",
        "title",
        "description",
        "addresses",
        "mCloudCategories",
        "DCATThemes",
        "distributions",
        "license"
      ],
      "title": "MCLOUD"
    },
    "Address": {
      "type": "object",
      "additionalProperties": false,
      "properties": {
        "ref": {
          "type": "string"
        },
        "type": {
          "$ref": "#/definitions/KeyValue"
        }
      },
      "required": ["ref", "type"],
      "title": "Address"
    },
    "Distribution": {
      "type": "object",
      "additionalProperties": false,
      "properties": {
        "link": {
          "$ref": "#/definitions/Link"
        },
        "type": {
          "$ref": "#/definitions/KeyValue"
        },
        "title": {
          "type": ["string", "null"]
        },
        "format": {
          "oneOf": [
            {
              "type": "null"
            },
            {
              "$ref": "#/definitions/KeyValue"
            }
          ]
        }
      },
      "required": ["link", "type"],
      "title": "Distribution"
    },
    "Link": {
      "type": "object",
      "additionalProperties": false,
      "properties": {
        "uri": {
          "type": ["string", "null"]
        },
        "value": {
          "type": ["string", "null"]
        },
        "asLink": {
          "type": ["boolean", "null"]
        }
      },
      "required": ["asLink", "uri", "value"],
      "title": "Link"
    },
    "Event": {
      "type": "object",
      "additionalProperties": false,
      "properties": {
        "date": {
          "type": ["string", "null"],
          "format": "date-time"
        },
        "text": {
          "$ref": "#/definitions/KeyValue"
        }
      },
      "required": ["date", "text"],
      "title": "Event"
    },
    "Spatial": {
      "type": "object",
      "additionalProperties": true,
      "properties": {
        "type": {
          "type": "string"
        },
        "title": {
          "type": ["string", "null"]
        },
        "value": {
          "oneOf": [
            {
              "type": "null"
            },
            {
              "$ref": "#/definitions/Value"
            }
          ]
        },
        "wkt": {
          "type": ["string", "null"]
        }
      },
      "required": ["title", "type", "value"],
      "title": "Spatial"
    },
    "Value": {
      "type": "object",
      "additionalProperties": false,
      "properties": {
        "lat1": {
          "type": "number"
        },
        "lat2": {
          "type": "number"
        },
        "lon1": {
          "type": "number"
        },
        "lon2": {
          "type": "number"
        }
      },
      "required": ["lat1", "lat2", "lon1", "lon2"],
      "title": "Value"
    },
    "Temporal": {
      "type": "object",
      "additionalProperties": false,
      "properties": {
        "rangeType": {
          "oneOf": [
            {
              "type": "null"
            },
            {
              "$ref": "#/definitions/KeyValue"
            }
          ]
        },
        "timeSpanDate": {
          "type": ["string", "null"],
          "format": "date-time"
        },
        "timeSpanRange": {
          "oneOf": [
            {
              "type": "null"
            },
            {
              "$ref": "#/definitions/Range"
            }
          ]
        }
      },
      "required": ["rangeType"],
      "title": "Temporal"
    },
    "KeyValue": {
      "type": "object",
      "additionalProperties": false,
      "properties": {
        "key": {
          "type": ["string", "null"]
        },
        "value": {
          "type": ["string", "null"]
        }
      },
      "title": "KeyValue"
    },
    "Range": {
      "type": "object",
      "additionalProperties": false,
      "properties": {
        "start": {
          "type": ["string", "null"],
          "format": "date-time"
        },
        "end": {
          "type": ["string", "null"],
          "format": "date-time"
        }
      },
      "title": "KeyValue"
    }
  }
}
