{
  "DCATThemes": [
    "TRAN",
    "REGI"
  ],
  "_type": "mCloudDoc",
  "_uuid": "1583881f-45c3-4105-b081-e33f19ce0b1e",
  "accessRights": null,
  "addresses": [
    {
      "ref": "0B2B815A-4E9D-4F47-8286-B2DE17CB874F",
      "type": {
        "key": "10"
      }
    }
  ],
  "description": "Sensordaten (ohne GPS-Signal) des ECOSense-Projekts. Der Datensatz setzt sich zusammen aus Sensordaten, die im 1 Hz-Bereich und 24 Hz-Bereich gemessen wurden. \n\nGesamtvolumen: 14859 Fahrten / 3,74 GB (komprimiert) / 36,2 GB (entpackt)\n\n\nFolgende Daten sind enthalten: \n- internal_index \n- 1Hz-Bereich: measured_date, estimated_date, longitude, latitude, speed, heading, certainty, temperature1, temperature2, humidity, pressure, altitude2\n- 24Hz-Bereich: Beschleunigung in drei Achsen (accel_x_01-24, accel_y_01-24, accel_z_01-24), Gyroskop in drei Achsen (gyro_x_01-24, gyro_y_01-24, gyro_z_01-24), Magnetometer in drei Achsen (mag_x_01-24, mag_y_01-24, mag_z_01-24). \n",
  "distributions": [
    {
      "link": {
        "uri": "https://ecosense01.vlba.uni-oldenburg.de/data/2020-mcloud-ecosense-data-export-nogps-1.7z",
        "value": "https://ecosense01.vlba.uni-oldenburg.de/data/2020-mcloud-ecosense-data-export-nogps-1.7z",
        "asLink": true
      },
      "type": {
        "key": "download"
      }
    }
  ],
  "events": null,
  "keywords": [],
  "license": {
    "key": "28"
  },
  "mCloudCategories": [
    "infrastructure",
    "roads"
  ],
  "mfundFKZ": null,
  "mfundProject": null,
  "origin": null,
  "periodicity": null,
  "spatial": null,
  "temporal": {
    "rangeType": null,
    "timeSpanRange": null
  },
  "title": "Test Doc"
}